{
  "artifactKind": "non-read-classifications",
  "counts": {
    "previewParserNeededRows": 37,
    "reportOnlyHighRiskRows": 72,
    "rows": 109
  },
  "generatedAt": "2026-06-03T01:20:07Z",
  "generatedFrom": [
    ".config/ags/widget/hyprland-settings/nonReadClassification.ts"
  ],
  "hyprlandVersion": "0.55.2",
  "items": [
    {
      "currentValueReadsBlocked": true,
      "futureControlKind": "read_only_gradient_preview",
      "notes": "Complex color/vector/path/regex value; preview-only until parser/control design exists.; color or gradient preview / border color for inactive windows",
      "officialSetting": "general.col.inactive_border",
      "parserDesignStatus": "needs_gradient_or_color_list_parser",
      "reason": "n/a - parser/control design needed",
      "riskClass": "visual_color_parser_risk",
      "rowId": "general.col.inactive_border",
      "shouldRemainReportOnly": false,
      "unresolvedCategory": "preview-parser-needed",
      "valueFamily": "gradient"
    },
    {
      "currentValueReadsBlocked": true,
      "futureControlKind": "read_only_gradient_preview",
      "notes": "Complex color/vector/path/regex value; preview-only until parser/control design exists.; color or gradient preview / border color for the active window",
      "officialSetting": "general.col.active_border",
      "parserDesignStatus": "needs_gradient_or_color_list_parser",
      "reason": "n/a - parser/control design needed",
      "riskClass": "visual_color_parser_risk",
      "rowId": "general.col.active_border",
      "shouldRemainReportOnly": false,
      "unresolvedCategory": "preview-parser-needed",
      "valueFamily": "gradient"
    },
    {
      "currentValueReadsBlocked": true,
      "futureControlKind": "read_only_gradient_preview",
      "notes": "Complex color/vector/path/regex value; preview-only until parser/control design exists.; color or gradient preview / inactive border color for window that cannot be added to a group",
      "officialSetting": "general.col.nogroup_border",
      "parserDesignStatus": "needs_gradient_or_color_list_parser",
      "reason": "n/a - parser/control design needed",
      "riskClass": "visual_color_parser_risk",
      "rowId": "general.col.nogroup_border",
      "shouldRemainReportOnly": false,
      "unresolvedCategory": "preview-parser-needed",
      "valueFamily": "gradient"
    },
    {
      "currentValueReadsBlocked": true,
      "futureControlKind": "read_only_gradient_preview",
      "notes": "Complex color/vector/path/regex value; preview-only until parser/control design exists.; color or gradient preview / active border color for window that cannot be added to a group",
      "officialSetting": "general.col.nogroup_border_active",
      "parserDesignStatus": "needs_gradient_or_color_list_parser",
      "reason": "n/a - parser/control design needed",
      "riskClass": "visual_color_parser_risk",
      "rowId": "general.col.nogroup_border_active",
      "shouldRemainReportOnly": false,
      "unresolvedCategory": "preview-parser-needed",
      "valueFamily": "gradient"
    },
    {
      "currentValueReadsBlocked": true,
      "futureControlKind": "read_only_color_swatch",
      "notes": "Complex color/vector/path/regex value; preview-only until parser/control design exists.; color or gradient preview / shadow's color. Alpha dictates shadow's opacity.",
      "officialSetting": "decoration.shadow.color",
      "parserDesignStatus": "needs_color_parser",
      "reason": "n/a - parser/control design needed",
      "riskClass": "visual_color_parser_risk",
      "rowId": "decoration.shadow.color",
      "shouldRemainReportOnly": false,
      "unresolvedCategory": "preview-parser-needed",
      "valueFamily": "color"
    },
    {
      "currentValueReadsBlocked": true,
      "futureControlKind": "read_only_color_swatch",
      "notes": "Complex color/vector/path/regex value; preview-only until parser/control design exists.; color or gradient preview / inactive shadow color. (if not set, will fall back to col.shadow)",
      "officialSetting": "decoration.shadow.color_inactive",
      "parserDesignStatus": "needs_color_parser",
      "reason": "n/a - parser/control design needed",
      "riskClass": "visual_color_parser_risk",
      "rowId": "decoration.shadow.color_inactive",
      "shouldRemainReportOnly": false,
      "unresolvedCategory": "preview-parser-needed",
      "valueFamily": "color"
    },
    {
      "currentValueReadsBlocked": true,
      "futureControlKind": "read_only_tuple_display",
      "notes": "Complex color/vector/path/regex value; preview-only until parser/control design exists.; two-value input preview / shadow's rendering offset.",
      "officialSetting": "decoration.shadow.offset",
      "parserDesignStatus": "needs_vec2_tuple_parser",
      "reason": "n/a - parser/control design needed",
      "riskClass": "tuple_shape_parser_risk",
      "rowId": "decoration.shadow.offset",
      "shouldRemainReportOnly": false,
      "unresolvedCategory": "preview-parser-needed",
      "valueFamily": "vector_tuple"
    },
    {
      "currentValueReadsBlocked": true,
      "futureControlKind": "read_only_color_swatch",
      "notes": "Complex color/vector/path/regex value; preview-only until parser/control design exists.; color or gradient preview / glow's color. Alpha dictates glow's opacity.",
      "officialSetting": "decoration.glow.color",
      "parserDesignStatus": "needs_color_parser",
      "reason": "n/a - parser/control design needed",
      "riskClass": "visual_color_parser_risk",
      "rowId": "decoration.glow.color",
      "shouldRemainReportOnly": false,
      "unresolvedCategory": "preview-parser-needed",
      "valueFamily": "color"
    },
    {
      "currentValueReadsBlocked": true,
      "futureControlKind": "read_only_color_swatch",
      "notes": "Complex color/vector/path/regex value; preview-only until parser/control design exists.; color or gradient preview / inactive glow color. (if not set, will fall back to decoration:glow:color)",
      "officialSetting": "decoration.glow.color_inactive",
      "parserDesignStatus": "needs_color_parser",
      "reason": "n/a - parser/control design needed",
      "riskClass": "visual_color_parser_risk",
      "rowId": "decoration.glow.color_inactive",
      "shouldRemainReportOnly": false,
      "unresolvedCategory": "preview-parser-needed",
      "valueFamily": "color"
    },
    {
      "currentValueReadsBlocked": true,
      "futureControlKind": "sanitized_path_preview",
      "notes": "Complex color/vector/path/regex value; preview-only until parser/control design exists.; text preview/read-only value / a path to a custom shader to be applied at the end of rendering.",
      "officialSetting": "decoration.screen_shader",
      "parserDesignStatus": "needs_sanitized_path_preview",
      "reason": "n/a - parser/control design needed",
      "riskClass": "path_or_shader_preview_risk",
      "rowId": "decoration.screen_shader",
      "shouldRemainReportOnly": false,
      "unresolvedCategory": "preview-parser-needed",
      "valueFamily": "path_shader_path"
    },
    {
      "currentValueReadsBlocked": true,
      "futureControlKind": "sanitized_path_preview",
      "notes": "Complex color/vector/path/regex value; preview-only until parser/control design exists.; text preview/read-only value / Appropriate XKB keymap file",
      "officialSetting": "input.kb_file",
      "parserDesignStatus": "needs_sanitized_path_preview",
      "reason": "n/a - parser/control design needed",
      "riskClass": "input_file_preview_risk",
      "rowId": "input.kb_file",
      "shouldRemainReportOnly": false,
      "unresolvedCategory": "preview-parser-needed",
      "valueFamily": "path_shader_path"
    },
    {
      "currentValueReadsBlocked": true,
      "futureControlKind": "read_only_text_or_enum_label",
      "notes": "Complex color/vector/path/regex value; preview-only until parser/control design exists.; dropdown after allowed-values audit / Sets the cursor acceleration profile. [adaptive/flat/custom]",
      "officialSetting": "input.accel_profile",
      "parserDesignStatus": "needs_enum_or_custom_string_parser",
      "reason": "n/a - parser/control design needed",
      "riskClass": "freeform_string_parser_risk",
      "rowId": "input.accel_profile",
      "shouldRemainReportOnly": false,
      "unresolvedCategory": "preview-parser-needed",
      "valueFamily": "mixed_freeform_string"
    },
    {
      "currentValueReadsBlocked": true,
      "futureControlKind": "read_only_numeric_list_display",
      "notes": "Complex color/vector/path/regex value; preview-only until parser/control design exists.; text preview/read-only value / Sets the scroll acceleration profile, when accel_profile is set to custom.",
      "officialSetting": "input.scroll_points",
      "parserDesignStatus": "needs_numeric_list_parser",
      "reason": "n/a - parser/control design needed",
      "riskClass": "numeric_list_parser_risk",
      "rowId": "input.scroll_points",
      "shouldRemainReportOnly": false,
      "unresolvedCategory": "preview-parser-needed",
      "valueFamily": "bezierish_numeric_list"
    },
    {
      "currentValueReadsBlocked": true,
      "futureControlKind": "read_only_tuple_display",
      "notes": "Complex color/vector/path/regex value; preview-only until parser/control design exists.; two-value input preview / position of the mapped region in monitor layout.",
      "officialSetting": "input.tablet.region_position",
      "parserDesignStatus": "needs_vec2_tuple_parser",
      "reason": "n/a - parser/control design needed",
      "riskClass": "tuple_shape_parser_risk",
      "rowId": "input.tablet.region_position",
      "shouldRemainReportOnly": false,
      "unresolvedCategory": "preview-parser-needed",
      "valueFamily": "vector_tuple"
    },
    {
      "currentValueReadsBlocked": true,
      "futureControlKind": "read_only_tuple_display",